[
  {
    "status": "done",
    "files": ["src/services/auth.ts", "src/middleware/auth.ts", "src/routes/auth.ts", "src/types/auth.ts"],
    "symbols": [
      { "symbol": "AuthService", "file": "src/services/auth.ts", "line": 42 },
      { "symbol": "authMiddleware", "file": "src/middleware/auth.ts", "line": 8 },
      { "symbol": "TokenPayload", "file": "src/types/auth.ts", "line": 3 }
    ],
    "reuse_candidates": [
      { "symbol": "AuthService", "file": "src/services/auth.ts", "fit": "extend" },
      { "symbol": "authMiddleware", "file": "src/middleware/auth.ts", "fit": "compose with" }
    ],
    "usage": { "prompt_tokens": 4200, "completion_tokens": 600 }
  }
]
